{
  "id": "example-miner-boost",
  "version": "1.0.0",
  "description": "Increases miner productivity by 10% when iron storage is above 50",
  "author": "SeedWorld Team",
  "enabled": true,
  "dependencies": [],
  "hooks": {
    "advanceTick": {
      "id": "miner-boost-tick",
      "priority": 50,
      "enabled": true,
      "phase": "update",
      "code": "// Deterministic miner productivity boost\n// Only applies when iron storage > 50\nconst ironStorage = state.resources?.iron || 0;\nif (ironStorage > 50) {\n  // Boost miner production by 10%\n  const boostMultiplier = 1.1;\n  const boostedState = kernel.mutateState({\n    resources: {\n      ...state.resources,\n      // This would be calculated by the actual game logic\n      // For now, just return the state with boost metadata\n      minerBoost: boostMultiplier\n    }\n  });\n  return boostedState;\n}\nreturn state;"
    }
  },
  "schema": {
    "version": "1.0",
    "type": "gameplay",
    "compatibility": {
      "kernel": ">=1.0.0",
      "game": ">=3.0.0"
    }
  },
  "rollback": {
    "type": "state-snapshot",
    "restore": "remove-miner-boost-metadata"
  },
  "validation": {
    "deterministic": true,
    "sideEffects": false,
    "externalDependencies": false
  }
}
